{
  "$schema": "https://json-schema.org/draft/2020-12/schema",
  "title": "Attack Definition v1",
  "type": "object",
  "properties": {
    "schemaVersion": {
      "const": "1.0"
    },
    "id": {
      "type": "string",
      "minLength": 1,
      "maxLength": 80,
      "pattern": "^[a-z][a-z0-9_-]*$"
    },
    "label": {
      "type": "string",
      "minLength": 1,
      "maxLength": 2000
    },
    "description": {
      "type": "string",
      "minLength": 1,
      "maxLength": 2000
    },
    "supportedInvestigationTypes": {
      "type": "array",
      "items": {
        "enum": [
          "WEB_LOG",
          "PROXY_LOG",
          "AUTH_LOG",
          "APPLICATION_LOG",
          "NETWORK_LOG",
          "EMAIL",
          "BROWSER_HISTORY",
          "DEVICE",
          "FILE",
          "CONFIGURATION"
        ]
      },
      "minItems": 1,
      "maxItems": 10
    },
    "category": {
      "type": "string",
      "minLength": 1,
      "maxLength": 80,
      "pattern": "^[a-z][a-z0-9_-]*$"
    },
    "authoring": {
      "type": "object",
      "properties": {
        "preferredInvestigationType": {
          "enum": [
            "WEB_LOG",
            "PROXY_LOG",
            "AUTH_LOG",
            "APPLICATION_LOG",
            "NETWORK_LOG",
            "EMAIL",
            "BROWSER_HISTORY",
            "DEVICE",
            "FILE",
            "CONFIGURATION"
          ]
        },
        "evidenceAnswer": {
          "type": "string",
          "minLength": 1,
          "maxLength": 1000
        },
        "sourceNodeBinding": {
          "type": "string",
          "minLength": 1,
          "maxLength": 80,
          "pattern": "^[a-z][a-z0-9_-]*$"
        },
        "targetServiceBinding": {
          "type": "string",
          "minLength": 1,
          "maxLength": 80,
          "pattern": "^[a-z][a-z0-9_-]*$"
        },
        "investigationServiceBinding": {
          "type": "string",
          "minLength": 1,
          "maxLength": 80,
          "pattern": "^[a-z][a-z0-9_-]*$"
        }
      },
      "required": [
        "preferredInvestigationType",
        "evidenceAnswer",
        "sourceNodeBinding",
        "targetServiceBinding",
        "investigationServiceBinding"
      ],
      "additionalProperties": false
    },
    "incidentNarrative": {
      "type": "object",
      "properties": {
        "impactEffectPredicate": {
          "type": "string",
          "minLength": 1,
          "maxLength": 80,
          "pattern": "^[a-z][a-z0-9_-]*$"
        },
        "requiredArtifactIds": {
          "type": "array",
          "minItems": 2,
          "maxItems": 16,
          "items": {
            "type": "string",
            "minLength": 1,
            "maxLength": 80,
            "pattern": "^[a-z][a-z0-9_-]*$"
          }
        },
        "attackerAction": { "type": "string", "minLength": 1, "maxLength": 2000 },
        "impact": { "type": "string", "minLength": 1, "maxLength": 1000 },
        "allegation": { "type": "string", "minLength": 1, "maxLength": 1000 },
        "prosecutionKnowledge": { "type": "string", "minLength": 1, "maxLength": 2000 },
        "causalRefutation": { "type": "string", "minLength": 1, "maxLength": 2000 },
        "verdictBasis": { "type": "string", "minLength": 1, "maxLength": 2000 }
      },
      "required": [
        "impactEffectPredicate",
        "requiredArtifactIds",
        "attackerAction",
        "impact",
        "allegation",
        "prosecutionKnowledge",
        "causalRefutation",
        "verdictBasis"
      ],
      "additionalProperties": false
    },
    "bindings": {
      "type": "array",
      "items": {
        "type": "object",
        "properties": {
          "id": {
            "type": "string",
            "minLength": 1,
            "maxLength": 80,
            "pattern": "^[a-z][a-z0-9_-]*$"
          },
          "kind": {
            "enum": [
              "node",
              "service",
              "entity"
            ]
          }
        },
        "required": [
          "id",
          "kind"
        ],
        "additionalProperties": false
      },
      "minItems": 1,
      "maxItems": 16
    },
    "targetTypes": {
      "type": "array",
      "items": {
        "type": "object",
        "properties": {
          "binding": {
            "type": "string",
            "minLength": 1,
            "maxLength": 80,
            "pattern": "^[a-z][a-z0-9_-]*$"
          },
          "values": {
            "type": "array",
            "items": {
              "type": "string",
              "minLength": 1,
              "maxLength": 80,
              "pattern": "^[a-z][a-z0-9_-]*$"
            },
            "minItems": 1,
            "maxItems": 32
          }
        },
        "required": [
          "binding",
          "values"
        ],
        "additionalProperties": false
      },
      "minItems": 0,
      "maxItems": 256
    },
    "requiredRoles": {
      "type": "array",
      "items": {
        "type": "object",
        "properties": {
          "binding": {
            "type": "string",
            "minLength": 1,
            "maxLength": 80,
            "pattern": "^[a-z][a-z0-9_-]*$"
          },
          "values": {
            "type": "array",
            "items": {
              "type": "string",
              "minLength": 1,
              "maxLength": 80,
              "pattern": "^[a-z][a-z0-9_-]*$"
            },
            "minItems": 1,
            "maxItems": 32
          }
        },
        "required": [
          "binding",
          "values"
        ],
        "additionalProperties": false
      },
      "minItems": 0,
      "maxItems": 256
    },
    "platforms": {
      "type": "array",
      "items": {
        "type": "object",
        "properties": {
          "binding": {
            "type": "string",
            "minLength": 1,
            "maxLength": 80,
            "pattern": "^[a-z][a-z0-9_-]*$"
          },
          "values": {
            "type": "array",
            "items": {
              "type": "string",
              "minLength": 1,
              "maxLength": 80,
              "pattern": "^[a-z][a-z0-9_-]*$"
            },
            "minItems": 1,
            "maxItems": 32
          }
        },
        "required": [
          "binding",
          "values"
        ],
        "additionalProperties": false
      },
      "minItems": 0,
      "maxItems": 256
    },
    "requiredServices": {
      "type": "array",
      "items": {
        "type": "object",
        "properties": {
          "binding": {
            "type": "string",
            "minLength": 1,
            "maxLength": 80,
            "pattern": "^[a-z][a-z0-9_-]*$"
          },
          "values": {
            "type": "array",
            "items": {
              "type": "string",
              "minLength": 1,
              "maxLength": 80,
              "pattern": "^[a-z][a-z0-9_-]*$"
            },
            "minItems": 1,
            "maxItems": 32
          },
          "node": {
            "type": "string",
            "minLength": 1,
            "maxLength": 80,
            "pattern": "^[a-z][a-z0-9_-]*$"
          }
        },
        "required": [
          "binding",
          "values",
          "node"
        ],
        "additionalProperties": false
      },
      "minItems": 0,
      "maxItems": 256
    },
    "prerequisites": {
      "type": "array",
      "items": {
        "type": "object",
        "properties": {
          "source": {
            "enum": [
              "vulnerabilities",
              "attackerInitialPrivileges",
              "requiredUserActions",
              "loggingConfiguration",
              "authenticationConditions",
              "otherConditions"
            ]
          },
          "predicate": {
            "type": "string",
            "minLength": 1,
            "maxLength": 80,
            "pattern": "^[a-z][a-z0-9_-]*$"
          },
          "args": {
            "type": "array",
            "items": {
              "type": "string",
              "pattern": "^\\$[a-z][a-z0-9_-]*$",
              "maxLength": 81
            },
            "minItems": 1,
            "maxItems": 8
          },
          "value": {
            "type": "boolean"
          },
          "description": {
            "type": "string",
            "minLength": 1,
            "maxLength": 2000
          }
        },
        "required": [
          "source",
          "predicate",
          "args",
          "value",
          "description"
        ],
        "additionalProperties": false
      },
      "minItems": 1,
      "maxItems": 64
    },
    "requiredPrivileges": {
      "type": "array",
      "items": {
        "type": "object",
        "properties": {
          "source": {
            "enum": [
              "vulnerabilities",
              "attackerInitialPrivileges",
              "requiredUserActions",
              "loggingConfiguration",
              "authenticationConditions",
              "otherConditions"
            ]
          },
          "predicate": {
            "type": "string",
            "minLength": 1,
            "maxLength": 80,
            "pattern": "^[a-z][a-z0-9_-]*$"
          },
          "args": {
            "type": "array",
            "items": {
              "type": "string",
              "pattern": "^\\$[a-z][a-z0-9_-]*$",
              "maxLength": 81
            },
            "minItems": 1,
            "maxItems": 8
          },
          "value": {
            "type": "boolean"
          },
          "description": {
            "type": "string",
            "minLength": 1,
            "maxLength": 2000
          }
        },
        "required": [
          "source",
          "predicate",
          "args",
          "value",
          "description"
        ],
        "additionalProperties": false
      },
      "minItems": 0,
      "maxItems": 64
    },
    "requiredReachability": {
      "type": "array",
      "items": {
        "type": "object",
        "properties": {
          "from": {
            "type": "string",
            "minLength": 1,
            "maxLength": 80,
            "pattern": "^[a-z][a-z0-9_-]*$"
          },
          "toService": {
            "type": "string",
            "minLength": 1,
            "maxLength": 80,
            "pattern": "^[a-z][a-z0-9_-]*$"
          },
          "description": {
            "type": "string",
            "minLength": 1,
            "maxLength": 2000
          }
        },
        "required": [
          "from",
          "toService",
          "description"
        ],
        "additionalProperties": false
      },
      "minItems": 0,
      "maxItems": 64
    },
    "effects": {
      "type": "array",
      "items": {
        "type": "object",
        "properties": {
          "source": {
            "enum": [
              "attackerInitialPrivileges",
              "authenticationConditions",
              "otherConditions"
            ]
          },
          "predicate": {
            "type": "string",
            "minLength": 1,
            "maxLength": 80,
            "pattern": "^[a-z][a-z0-9_-]*$"
          },
          "args": {
            "type": "array",
            "items": {
              "type": "string",
              "pattern": "^\\$[a-z][a-z0-9_-]*$",
              "maxLength": 81
            },
            "minItems": 1,
            "maxItems": 8
          },
          "value": {
            "type": "boolean"
          },
          "description": {
            "type": "string",
            "minLength": 1,
            "maxLength": 2000
          }
        },
        "required": [
          "source",
          "predicate",
          "args",
          "value",
          "description"
        ],
        "additionalProperties": false
      },
      "minItems": 1,
      "maxItems": 64
    },
    "observableArtifacts": {
      "type": "array",
      "items": {
        "type": "object",
        "properties": {
          "id": {
            "type": "string",
            "minLength": 1,
            "maxLength": 80,
            "pattern": "^[a-z][a-z0-9_-]*$"
          },
          "description": {
            "type": "string",
            "minLength": 1,
            "maxLength": 2000
          },
          "conditions": {
            "type": "array",
            "items": {
              "type": "object",
              "properties": {
                "source": {
                  "enum": [
                    "vulnerabilities",
                    "attackerInitialPrivileges",
                    "requiredUserActions",
                    "loggingConfiguration",
                    "authenticationConditions",
                    "otherConditions"
                  ]
                },
                "predicate": {
                  "type": "string",
                  "minLength": 1,
                  "maxLength": 80,
                  "pattern": "^[a-z][a-z0-9_-]*$"
                },
                "args": {
                  "type": "array",
                  "items": {
                    "type": "string",
                    "pattern": "^\\$[a-z][a-z0-9_-]*$",
                    "maxLength": 81
                  },
                  "minItems": 1,
                  "maxItems": 8
                },
                "value": {
                  "type": "boolean"
                },
                "description": {
                  "type": "string",
                  "minLength": 1,
                  "maxLength": 2000
                }
              },
              "required": [
                "source",
                "predicate",
                "args",
                "value",
                "description"
              ],
              "additionalProperties": false
            },
            "minItems": 1,
            "maxItems": 32
          },
          "acquisition": {
            "type": "object",
            "properties": {
              "binding": {
                "type": "string",
                "minLength": 1,
                "maxLength": 80
              },
              "logSource": {
                "enum": [
                  "WEB_LOG",
                  "AUTH_LOG",
                  "APPLICATION_LOG",
                  "DEVICE",
                  "FILE",
                  "CONFIGURATION"
                ]
              },
              "type": {
                "enum": [
                  "WEB_ACCESS_LOG",
                  "AUTHENTICATION_LOG",
                  "APPLICATION_LOG",
                  "DEVICE_INFORMATION",
                  "FILE_METADATA",
                  "DOCUMENT"
                ]
              },
              "targetType": {
                "enum": [
                  "SERVER",
                  "LOG_SOURCE",
                  "ENDPOINT"
                ]
              }
            },
            "required": [
              "binding",
              "logSource",
              "type",
              "targetType"
            ],
            "additionalProperties": false
          }
        },
        "required": [
          "id",
          "description",
          "conditions"
        ],
        "additionalProperties": false
      },
      "minItems": 0,
      "maxItems": 64
    },
    "relatedAttackPatterns": {
      "type": "array",
      "items": {
        "type": "string",
        "minLength": 1,
        "maxLength": 2000
      },
      "minItems": 0,
      "maxItems": 64
    },
    "references": {
      "type": "array",
      "items": {
        "type": "object",
        "properties": {
          "id": {
            "type": "string",
            "minLength": 1,
            "maxLength": 80,
            "pattern": "^[a-z][a-z0-9_-]*$"
          },
          "title": {
            "type": "string",
            "minLength": 1,
            "maxLength": 2000
          },
          "url": {
            "type": "string",
            "pattern": "^https://",
            "maxLength": 2048
          },
          "supports": {
            "type": "string",
            "minLength": 1,
            "maxLength": 2000
          }
        },
        "required": [
          "id",
          "title",
          "url",
          "supports"
        ],
        "additionalProperties": false
      },
      "minItems": 1,
      "maxItems": 32
    },
    "stages": {
      "type": "array",
      "items": {
        "enum": [
          "DELIVERY",
          "INITIAL_ACCESS",
          "EXECUTION",
          "PRIVILEGE_ESCALATION",
          "COLLECTION"
        ]
      },
      "minItems": 1,
      "maxItems": 5
    }
  },
  "required": [
    "schemaVersion",
    "id",
    "label",
    "description",
    "category",
    "bindings",
    "targetTypes",
    "platforms",
    "requiredServices",
    "prerequisites",
    "requiredPrivileges",
    "requiredReachability",
    "effects",
    "observableArtifacts",
    "relatedAttackPatterns",
    "references"
  ],
  "additionalProperties": false
}
