{
  "schemaVersion": "1.0",
  "id": "stored_xss",
  "label": "Stored XSS",
  "category": "web_injection",
  "description": "保存した投稿が後の閲覧応答で実行可能なスクリプトとして解釈される範囲。投稿権限、永続化、出力時の防御不足、閲覧、実行制御を分離する。資格情報窃取やOS侵害を効果にしない。",
  "supportedInvestigationTypes": [
    "APPLICATION_LOG",
    "WEB_LOG",
    "DEVICE",
    "CONFIGURATION"
  ],
  "incidentNarrative": {
    "impactEffectPredicate": "false_announcement_posted_by_script",
    "requiredArtifactIds": ["stored_content_record", "web_access_record", "browser_execution_record", "announcement_audit_record", "browser_request_initiator_record"],
    "attackerAction": "被告人とは別の攻撃者が、閲覧時に告知投稿要求を自動送信するスクリプトを先に掲示板へ保存した。被告人がその投稿を閲覧した際、保存済みスクリプトが被告人のブラウザ上で実行され、被告人のアカウントで認証されたWebセッションを利用して、告知投稿要求を送信した。",
    "impact": "掲示板に虚偽の告知が掲載され、業務連絡の内容が改ざんされた。",
    "allegation": "虚偽の告知を受理した記録に、被告人のアカウントで認証されたセッションの識別子が残っていたことを根拠として、検察側は、被告人自身が告知を作成し、投稿操作を行ったと主張している。",
    "prosecutionKnowledge": "検察側は、被告人のアカウントで認証されたセッションの識別子を伴う告知投稿が受理されたことを把握している。一方、先に保存された投稿、閲覧時のスクリプト実行、そのスクリプトによって開始された投稿要求のつながりを把握せず、被告人が手動で投稿したものだと誤認している。",
    "causalRefutation": "取得可能な技術資料を、対象・処理識別子・記録範囲に基づいて段階ごとに照合し、攻撃の処理経路・対象・結果と各記録の限界を確認する。アカウント名・IPアドレス・端末情報だけから人物や意図を特定せず、被告人による攻撃処理の準備・作成・直接操作という検察側の主張が資料で裏付けられるかを検討する。必要な技術資料又は対応関係が不足する場合は論証未成立として差し戻す。",
    "verdictBasis": "取得可能な技術資料から被告人による攻撃処理の準備・作成・直接操作を確認できず、第三者による操作、認証情報の悪用、誘導又は自動処理の可能性を排除できない場合、その合理的な疑いを無罪判決の根拠とする。第三者が実行したと断定したり、その人物を技術資料だけから特定したりしない。"
  },
  "bindings": [
    {
      "id": "source",
      "kind": "node"
    },
    {
      "id": "client",
      "kind": "node"
    },
    {
      "id": "web_host",
      "kind": "node"
    },
    {
      "id": "browser",
      "kind": "service"
    },
    {
      "id": "web",
      "kind": "service"
    },
    {
      "id": "attacker",
      "kind": "entity"
    },
    {
      "id": "victim",
      "kind": "entity"
    },
    {
      "id": "request",
      "kind": "entity"
    }
  ],
  "targetTypes": [
    {
      "binding": "attacker",
      "values": [
        "actor"
      ]
    },
    {
      "binding": "victim",
      "values": [
        "user"
      ]
    },
    {
      "binding": "request",
      "values": [
        "web_request"
      ]
    }
  ],
  "requiredRoles": [
    {
      "binding": "client",
      "values": [
        "workstation"
      ]
    },
    {
      "binding": "web_host",
      "values": [
        "web_server"
      ]
    }
  ],
  "platforms": [
    {
      "binding": "browser",
      "values": [
        "browser"
      ]
    },
    {
      "binding": "web",
      "values": [
        "web"
      ]
    }
  ],
  "requiredServices": [
    {
      "binding": "browser",
      "values": [
        "web_browser"
      ],
      "node": "client"
    },
    {
      "binding": "web",
      "values": [
        "web_application"
      ],
      "node": "web_host"
    }
  ],
  "prerequisites": [
    {
      "source": "otherConditions",
      "predicate": "stored_payload_precedes_retrieval",
      "args": [
        "$attacker",
        "$web",
        "$request"
      ],
      "value": true,
      "description": "投稿権限を得た攻撃者が構成した投稿の保存は、当該閲覧リクエストより前に完了している。攻撃発生日時は閲覧時の実行時点であり、投稿日時とは別である。"
    },
    {
      "source": "otherConditions",
      "predicate": "request_targets_service",
      "args": [
        "$request",
        "$web"
      ],
      "value": true,
      "description": "保存投稿の閲覧リクエストの対象はこのWebサービスである。"
    },
    {
      "source": "otherConditions",
      "predicate": "user_uses_browser",
      "args": [
        "$victim",
        "$browser"
      ],
      "value": true,
      "description": "抽象的利用者がこのブラウザを利用する教材条件。被告人との同一性は設定しない。"
    },
    {
      "source": "vulnerabilities",
      "predicate": "stored_content_rendered_as_script",
      "args": [
        "$web",
        "$request"
      ],
      "value": true,
      "description": "投稿内容を永続化した後、閲覧応答に適切なエンコード・サニタイズなしで挿入する欠陥がある。単なる文字列保存ではない。"
    },
    {
      "source": "otherConditions",
      "predicate": "browser_request_issued",
      "args": [
        "$victim",
        "$browser",
        "$web",
        "$request"
      ],
      "value": true,
      "description": "保存後に利用者が閲覧リクエストを送る。前段のメール誘導効果または明示閲覧条件が必要。"
    },
    {
      "source": "otherConditions",
      "predicate": "script_execution_permitted",
      "args": [
        "$browser",
        "$web",
        "$request"
      ],
      "value": true,
      "description": "対象応答のスクリプトがブラウザ設定や実効CSPで阻止されない。"
    },
    {
      "source": "authenticationConditions",
      "predicate": "request_access_permitted",
      "args": [
        "$victim",
        "$web",
        "$request"
      ],
      "value": true,
      "description": "閲覧リクエストの認証・認可条件を満たす。投稿者と閲覧者を同一人物とみなさない。"
    }
  ],
  "requiredPrivileges": [
    {
      "source": "attackerInitialPrivileges",
      "predicate": "can_store_content",
      "args": [
        "$attacker",
        "$web"
      ],
      "value": true,
      "description": "投稿・保存権限がある。前段の不正ログイン効果または明示初期条件で確認する。"
    },
    {
      "source": "attackerInitialPrivileges",
      "predicate": "controls_node",
      "args": [
        "$attacker",
        "$source"
      ],
      "value": true,
      "description": "攻撃者が投稿元ノードを操作できる。"
    }
  ],
  "requiredReachability": [
    {
      "from": "source",
      "toService": "web",
      "description": "投稿元から保存先Webサービスへの到達性。"
    },
    {
      "from": "client",
      "toService": "web",
      "description": "閲覧端末から保存投稿への到達性。"
    }
  ],
  "effects": [
    {
      "source": "otherConditions",
      "predicate": "script_executed_in_origin",
      "args": [
        "$attacker",
        "$victim",
        "$browser",
        "$web",
        "$request"
      ],
      "value": true,
      "description": "保存済み投稿に由来するスクリプトが閲覧ブラウザの対象Webオリジンで実行される。資格情報窃取、OS権限、DB権限は含まない。"
    }
  ],
  "observableArtifacts": [
    {
      "id": "stored_content_record",
      "description": "合成投稿の保存・取得内容と識別子の監査資料。非実行ソース抜粋と閲覧対象の対応を示す。保存だけでは実行の証明にならない。",
      "conditions": [
        {
          "source": "loggingConfiguration",
          "predicate": "stored_content_record_available",
          "args": [
            "$web",
            "$request"
          ],
          "value": true,
          "description": "対象記録の記録・保持・調査での取得が明示的に有効。秘密値は保持しない。"
        }
      ]
    },
    {
      "id": "web_access_record",
      "description": "対象リクエストのアクセス記録。取得設定と保持が確認された場合のみ候補にする。これだけではスクリプト実行や実際の操作者を断定できない。 JSON Linesでtimestamp、request_id、request_targetを保持する。要求先は絶対URL、またはorigin/hostとpathの組で記録し、異なるホストを同じパスだけで同一視しない。",
      "conditions": [
        {
          "source": "loggingConfiguration",
          "predicate": "access_record_available",
          "args": [
            "$web",
            "$request"
          ],
          "value": true,
          "description": "対象リクエストが記録対象で、必要な時刻・対象情報を含むアクセス記録が取得・保持されている。"
        }
      ]
    },
    {
      "id": "browser_execution_record",
      "description": "保存投稿の実行を識別できるブラウザの動作記録。アクセスログ、履歴、CSP違反を実行成功へ置き換えない。 専用記録はtimestamp、閲覧元のrequest_id、要求先request_target、execution_resultを保持し、Webの当該要求と対応する実行を識別する。",
      "conditions": [
        {
          "source": "loggingConfiguration",
          "predicate": "script_execution_record_available",
          "args": [
            "$browser",
            "$web",
            "$request"
          ],
          "value": true,
          "description": "対象記録の記録・保持・調査での取得が明示的に有効。秘密値は保持しない。"
        }
      ]
    }
  ],
  "relatedAttackPatterns": [
    "OWASP Stored XSS"
  ],
  "references": [
    {
      "id": "owasp_stored_xss",
      "title": "OWASP: Cross Site Scripting (Stored XSS)",
      "url": "https://community.owasp.org/attacks/xss/",
      "supports": "保存された攻撃入力を後で取得した利用者のブラウザで実行する仕組み。保存・閲覧・実行を分け、資格情報窃取は別条件とする。"
    },
    {
      "id": "owasp_logging",
      "title": "OWASP Logging Cheat Sheet",
      "url": "https://cheatsheetseries.owasp.org/cheatsheets/Logging_Cheat_Sheet.html",
      "supports": "observableArtifacts: ログの取得内容・取得設定・保持を個別に確認する原則。製品固有のイベントIDや既定記録は保証しない。"
    }
  ],
  "stages": [
    "EXECUTION"
  ],
  "authoring": {
    "sourceNodeBinding": "source",
    "targetServiceBinding": "web",
    "investigationServiceBinding": "web",
    "preferredInvestigationType": "APPLICATION_LOG",
    "evidenceAnswer": "合成投稿の保存・取得内容と識別子の監査資料。非実行ソース抜粋と閲覧対象の対応を示す。保存だけでは実行の証明にならない。 / 対象リクエストのアクセス記録。取得設定と保持が確認された場合のみ候補にする。これだけではスクリプト実行や実際の操作者を断定できない。 / 保存投稿の実行を識別できるブラウザの動作記録。アクセスログ、履歴、CSP違反を実行成功へ置き換えない。"
  }
}
