{
  "schemaVersion": "1.0",
  "id": "clickfix",
  "label": "ClickFix",
  "category": "social_engineering",
  "description": "偽の修復・本人確認画面に従い利用者が端末側で操作を実行してしまう教材。ページ閲覧だけでは実行されない。効果は当該端末の一般利用者の権限での実行に限定し、情報窃取・権限昇格は含めない。",
  "supportedInvestigationTypes": [
    "WEB_LOG",
    "DEVICE",
    "CONFIGURATION"
  ],
  "incidentNarrative": {
    "impactEffectPredicate": "endpoint_execution_available",
    "requiredArtifactIds": ["clickfix_page_record", "process_execution_record"],
    "attackerAction": "被告人とは別の攻撃者が、修復や本人確認を装った案内を用意し、被告人をその案内へ誘導した。被告人が表示された手順に従った結果、攻撃者が用意した教材用処理が、被告人の端末上で一般利用者の権限により起動した。",
    "impact": "案内に従った操作の後、教材用処理が被告人の端末上で一般利用者の権限により実行された。",
    "allegation": "プロセス実行記録に、被告人が使用していた端末の識別子と被告人のアカウントを示すユーザー識別子が残っていたため、検察側は、被告人が攻撃用処理を作成し、攻撃目的で当該処理を直接起動したと主張している。",
    "prosecutionKnowledge": "検察側は、被告人の端末におけるプロセス起動と実行ユーザー識別子を把握している。一方、直前に表示された偽案内と、その案内に記載された操作内容からプロセス起動までの対応を把握せず、記録上の実行ユーザーを攻撃用処理の作成者・立案者と取り違えている。",
    "causalRefutation": "取得可能な技術資料を、対象・処理識別子・記録範囲に基づいて段階ごとに照合し、攻撃の処理経路・対象・結果と各記録の限界を確認する。アカウント名・IPアドレス・端末情報だけから人物や意図を特定せず、被告人による攻撃処理の準備・作成・直接操作という検察側の主張が資料で裏付けられるかを検討する。必要な技術資料又は対応関係が不足する場合は論証未成立として差し戻す。",
    "verdictBasis": "取得可能な技術資料から被告人による攻撃処理の準備・作成・直接操作を確認できず、第三者による操作、認証情報の悪用、誘導又は自動処理の可能性を排除できない場合、その合理的な疑いを無罪判決の根拠とする。第三者が実行したと断定したり、その人物を技術資料だけから特定したりしない。"
  },
  "bindings": [
    {
      "id": "attacker",
      "kind": "entity"
    },
    {
      "id": "victim",
      "kind": "entity"
    },
    {
      "id": "request",
      "kind": "entity"
    },
    {
      "id": "client",
      "kind": "node"
    },
    {
      "id": "browser",
      "kind": "service"
    },
    {
      "id": "web_host",
      "kind": "node"
    },
    {
      "id": "web",
      "kind": "service"
    },
    {
      "id": "endpoint",
      "kind": "service"
    }
  ],
  "targetTypes": [
    {
      "binding": "attacker",
      "values": [
        "actor"
      ]
    },
    {
      "binding": "victim",
      "values": [
        "user"
      ]
    },
    {
      "binding": "request",
      "values": [
        "web_request"
      ]
    }
  ],
  "requiredRoles": [
    {
      "binding": "client",
      "values": [
        "workstation"
      ]
    },
    {
      "binding": "web_host",
      "values": [
        "web_server"
      ]
    }
  ],
  "platforms": [
    {
      "binding": "browser",
      "values": [
        "browser"
      ]
    },
    {
      "binding": "web",
      "values": [
        "web"
      ]
    },
    {
      "binding": "endpoint",
      "values": [
        "logging"
      ]
    },
    {
      "binding": "client",
      "values": [
        "windows"
      ]
    }
  ],
  "requiredServices": [
    {
      "binding": "browser",
      "node": "client",
      "values": [
        "web_browser"
      ]
    },
    {
      "binding": "web",
      "node": "web_host",
      "values": [
        "web_application"
      ]
    },
    {
      "binding": "endpoint",
      "node": "client",
      "values": [
        "logging"
      ]
    }
  ],
  "prerequisites": [
    {
      "source": "otherConditions",
      "predicate": "browser_request_issued",
      "args": [
        "$victim",
        "$browser",
        "$web",
        "$request"
      ],
      "value": true,
      "description": "対象の偽案内を開くWeb要求が発行される。前段のメール誘導、または明示した初期条件による。"
    },
    {
      "source": "otherConditions",
      "predicate": "deceptive_repair_content_served",
      "args": [
        "$attacker",
        "$web",
        "$request"
      ],
      "value": true,
      "description": "攻撃主体の制御する修復・本人確認を装う案内が対象要求へ返される。正規Web全体の侵害は仮定しない。"
    },
    {
      "source": "requiredUserActions",
      "predicate": "user_runs_deceptive_instruction",
      "args": [
        "$victim",
        "$client",
        "$request"
      ],
      "value": true,
      "description": "利用者が案内を信用して端末上で操作を実行する。閲覧・クリック・コピーだけでは足りない。実行文字列は教材に収録しない。"
    },
    {
      "source": "authenticationConditions",
      "predicate": "user_level_execution_permitted",
      "args": [
        "$victim",
        "$client"
      ],
      "value": true,
      "description": "利用者権限での当該実行が許可され、防御機能によって阻止されない。管理者権限はない。"
    }
  ],
  "requiredPrivileges": [
    {
      "source": "attackerInitialPrivileges",
      "predicate": "controls_lure_content",
      "args": [
        "$attacker",
        "$web"
      ],
      "value": true,
      "description": "攻撃主体が当該偽案内の内容を制御できるという初期条件。侵害経路を追加したものではない。"
    }
  ],
  "requiredReachability": [
    {
      "from": "client",
      "toService": "web",
      "description": "利用者端末から偽案内のWebサービスへ到達できる。"
    }
  ],
  "effects": [
    {
      "source": "otherConditions",
      "predicate": "endpoint_execution_available",
      "args": [
        "$attacker",
        "$client"
      ],
      "value": true,
      "description": "当該端末で攻撃主体の意図した処理が一般利用者の権限で実行される。暗号化・窃取・権限昇格は別条件。"
    }
  ],
  "observableArtifacts": [
    {
      "id": "clickfix_page_record",
      "description": "保存した偽案内の本文、要求ID、応答時刻、案内に記載された非実行の操作識別子instruction_ref。実行可能なコマンドは収録しない。要求IDはWeb要求だけを識別し、応答は端末での実行成功を示さない。",
      "conditions": [
        {
          "source": "loggingConfiguration",
          "predicate": "clickfix_page_record_available",
          "args": [
            "$web"
          ],
          "value": true,
          "description": "この教材では対象の記録・保持・調査取得が有効。下記資料説明で宣言した欄だけを記録し、製品の既定ログとは扱わない。"
        }
      ]
    },
    {
      "id": "process_execution_record",
      "description": "専用の端末記録。時刻、端末ID、非秘密のプロセス相関ID、親子関係、実行ユーザー識別子、起動結果、記録された処理内容に対応する非実行の操作識別子instruction_ref。instruction_refは保存案内との内容対応に用い、Web要求IDやプロセス相関IDとは区別する。記録から実際の人物や悪意は断定できない。",
      "conditions": [
        {
          "source": "loggingConfiguration",
          "predicate": "process_execution_record_available",
          "args": [
            "$endpoint"
          ],
          "value": true,
          "description": "この教材では対象の記録・保持・調査取得が有効。下記資料説明で宣言した欄だけを記録し、製品の既定ログとは扱わない。"
        }
      ]
    }
  ],
  "relatedAttackPatterns": [
    "ClickFix social engineering"
  ],
  "references": [
    {
      "id": "microsoft_clickfix",
      "title": "Microsoft: Think before you Click(Fix)",
      "url": "https://www.microsoft.com/en-us/security/blog/2025/08/21/think-before-you-clickfix-analyzing-the-clickfix-social-engineering-technique/",
      "supports": "偽の修復・確認を通した利用者による端末操作が実行の条件となる。ブラウザ閲覧のみの自動実行ではない。"
    },
    {
      "id": "owasp_logging",
      "title": "OWASP Logging Cheat Sheet",
      "url": "https://cheatsheetseries.owasp.org/cheatsheets/Logging_Cheat_Sheet.html",
      "supports": "取得・保持・記録範囲の明示と秘密値の除外。製品の既定記録は保証しない。"
    }
  ],
  "stages": [
    "EXECUTION"
  ],
  "authoring": {
    "sourceNodeBinding": "client",
    "targetServiceBinding": "web",
    "investigationServiceBinding": "web",
    "preferredInvestigationType": "WEB_LOG",
    "evidenceAnswer": "保存した偽案内の本文、要求ID、応答時刻、非実行の操作識別子instruction_ref。要求IDはWeb要求だけを識別し、応答は端末での実行成功を示さない。 / 専用の端末記録。時刻、端末ID、プロセス相関ID、親子関係、実行ユーザー識別子、起動結果、同じinstruction_ref。instruction_refで案内内容と処理内容の対応を確認し、Web要求ID・プロセス相関ID・人物は同一視しない。"
  }
}
