{
  "schemaVersion": "1.0",
  "id": "sql_injection",
  "label": "SQLインジェクション（Webアプリ経由）",
  "category": "web_injection",
  "description": "Webアプリに送られた入力がSQLの構文・意図を変え、アプリのDB接続権限内で実行される範囲。認証回避、データ窃取・改変、DB管理者権限、OS実行は自動的な効果にしない。",
  "supportedInvestigationTypes": [
    "WEB_LOG",
    "APPLICATION_LOG",
    "NETWORK_LOG",
    "CONFIGURATION"
  ],
  "authoring": {
    "preferredInvestigationType": "WEB_LOG",
    "evidenceAnswer": "Web記録の時刻・要求対象と、対応するDB監査の実行SQLの識別情報を照合する。DB記録のSQLの条件・構造を読み、要求の到達とSQLの実行を区別する。Web入力本文の記録は前提にしない。",
    "sourceNodeBinding": "source",
    "targetServiceBinding": "web",
    "investigationServiceBinding": "web"
  },
  "incidentNarrative": {
    "impactEffectPredicate": "restricted_rows_disclosed",
    "requiredArtifactIds": ["web_access_record", "database_statement_record", "application_response_record"],
    "attackerAction": "被告人とは別の攻撃者が、外部からWebサービスへSQLの構造を変える入力を含むHTTP要求を送信した。アプリケーションはその入力をSQL命令へ組み込み、アプリケーション自身のDB接続用アカウントで実行した。",
    "impact": "Webサービスを通じ、非公開レコードが本来許可されていない要求元へ返却された。",
    "allegation": "漏えい時のSQLが、被告人も利用者の一人だった検索サービスの共通DB接続用アカウントで実行されたことを根拠として、検察側は、被告人がそのSQLを直接入力したと主張している。",
    "prosecutionKnowledge": "検察側は、非公開レコードの返却、問題のSQLの実行、DB接続用アカウントを把握している。一方、そのアカウントが利用者本人ではなくWebアプリケーションの実行アカウントであることと、HTTP要求からSQL実行までの因果関係を把握せず、被告人の直接DB操作だと誤認している。",
    "causalRefutation": "取得可能な技術資料を、対象・処理識別子・記録範囲に基づいて段階ごとに照合し、攻撃の処理経路・対象・結果と各記録の限界を確認する。アカウント名・IPアドレス・端末情報だけから人物や意図を特定せず、被告人による攻撃処理の準備・作成・直接操作という検察側の主張が資料で裏付けられるかを検討する。必要な技術資料又は対応関係が不足する場合は論証未成立として差し戻す。",
    "verdictBasis": "取得可能な技術資料から被告人による攻撃処理の準備・作成・直接操作を確認できず、第三者による操作、認証情報の悪用、誘導又は自動処理の可能性を排除できない場合、その合理的な疑いを無罪判決の根拠とする。第三者が実行したと断定したり、その人物を技術資料だけから特定したりしない。"
  },
  "bindings": [
    {
      "id": "attacker",
      "kind": "entity"
    },
    {
      "id": "source",
      "kind": "node"
    },
    {
      "id": "web_host",
      "kind": "node"
    },
    {
      "id": "web",
      "kind": "service"
    },
    {
      "id": "db_host",
      "kind": "node"
    },
    {
      "id": "database",
      "kind": "service"
    },
    {
      "id": "db_principal",
      "kind": "entity"
    },
    {
      "id": "request",
      "kind": "entity"
    }
  ],
  "targetTypes": [
    {
      "binding": "attacker",
      "values": [
        "actor"
      ]
    },
    {
      "binding": "db_principal",
      "values": [
        "database_principal"
      ]
    },
    {
      "binding": "request",
      "values": [
        "web_request"
      ]
    }
  ],
  "requiredRoles": [
    {
      "binding": "web_host",
      "values": [
        "web_server"
      ]
    },
    {
      "binding": "db_host",
      "values": [
        "database_server"
      ]
    }
  ],
  "platforms": [
    {
      "binding": "web",
      "values": [
        "web"
      ]
    },
    {
      "binding": "database",
      "values": [
        "sql"
      ]
    }
  ],
  "requiredServices": [
    {
      "binding": "web",
      "node": "web_host",
      "values": [
        "web_application"
      ]
    },
    {
      "binding": "database",
      "node": "db_host",
      "values": [
        "sql_database"
      ]
    }
  ],
  "prerequisites": [
    {
      "source": "otherConditions",
      "predicate": "request_targets_service",
      "args": [
        "$request",
        "$web"
      ],
      "value": true,
      "description": "このリクエストのURL・経路は、割り当てたWebサービスを対象とする。"
    },
    {
      "source": "vulnerabilities",
      "predicate": "input_controls_sql_structure",
      "args": [
        "$web",
        "$database",
        "$request"
      ],
      "value": true,
      "description": "当該入力がSQLに組み込まれ、値として安全に束縛されずSQLの構文・意図を変えられる。単なるDB利用や任意の入力欄だけでは成立しない。"
    },
    {
      "source": "otherConditions",
      "predicate": "attacker_request_submitted",
      "args": [
        "$attacker",
        "$source",
        "$web",
        "$request"
      ],
      "value": true,
      "description": "攻撃者が当該送信元から対象リクエストを送るという明示条件。XSS実行だけからこの操作を補完しない。"
    },
    {
      "source": "authenticationConditions",
      "predicate": "request_access_permitted",
      "args": [
        "$attacker",
        "$web",
        "$request"
      ],
      "value": true,
      "description": "当該入力処理に到達するための認証・認可条件を満たす。認証不要の場合も確認済みとして明示する。"
    },
    {
      "source": "authenticationConditions",
      "predicate": "database_session_authorized",
      "args": [
        "$web",
        "$database",
        "$db_principal"
      ],
      "value": true,
      "description": "対象WebアプリがこのDB主体で対象DBへの接続認証・利用条件を満たす。"
    },
    {
      "source": "authenticationConditions",
      "predicate": "query_execution_permitted",
      "args": [
        "$db_principal",
        "$database",
        "$request"
      ],
      "value": true,
      "description": "当該改変クエリをDB主体の権限で実行できる。DBへの接続成功から管理者権限や任意操作権限を推測しない。"
    },
    {
      "source": "otherConditions",
      "predicate": "request_reaches_sql_execution",
      "args": [
        "$web",
        "$database",
        "$request"
      ],
      "value": true,
      "description": "当該リクエストがアプリ・WAF等で阻止されず、対象DBのSQL処理まで到達する。"
    }
  ],
  "requiredPrivileges": [
    {
      "source": "attackerInitialPrivileges",
      "predicate": "controls_node",
      "args": [
        "$attacker",
        "$source"
      ],
      "value": true,
      "description": "攻撃者がリクエストの送信元ノードを操作できる。"
    },
    {
      "source": "attackerInitialPrivileges",
      "predicate": "controls_request_input",
      "args": [
        "$attacker",
        "$request"
      ],
      "value": true,
      "description": "攻撃者がSQL処理へ渡る当該リクエスト入力を構成できる。"
    }
  ],
  "requiredReachability": [
    {
      "from": "source",
      "toService": "web",
      "description": "攻撃者の送信元からWebサービスへの到達性。"
    },
    {
      "from": "web_host",
      "toService": "database",
      "description": "WebアプリのノードからDBサービスへの到達性。攻撃者からDBへの直接接続は必須としない。"
    }
  ],
  "effects": [
    {
      "source": "otherConditions",
      "predicate": "sql_query_structure_modified",
      "args": [
        "$attacker",
        "$web",
        "$database",
        "$db_principal",
        "$request"
      ],
      "value": true,
      "description": "当該リクエストによりSQLが改変され、指定されたDB主体の権限範囲内で実行される。具体的な漏えい・改変被害は別途条件が必要。"
    }
  ],
  "observableArtifacts": [
    {
      "id": "web_access_record",
      "description": "対象リクエストのアクセス記録。取得設定と保持が確認された場合のみ候補にする。これだけではスクリプト実行や実際の操作者を断定できない。 JSON Linesでtimestamp、request_id、request_targetを保持する。要求先は絶対URL、またはorigin/hostとpathの組で記録し、異なるホストを同じパスだけで同一視しない。",
      "conditions": [
        {
          "source": "loggingConfiguration",
          "predicate": "access_record_available",
          "args": [
            "$web",
            "$request"
          ],
          "value": true,
          "description": "対象リクエストが記録対象で、必要な時刻・対象情報を含むアクセス記録が取得・保持されている。"
        }
      ]
    },
    {
      "id": "database_statement_record",
      "description": "実行されたSQLに対応するDB監査記録。対象クエリを識別できる記録内容と保持条件が必要であり、記録だけで実際の操作者は断定できない。",
      "conditions": [
        {
          "source": "loggingConfiguration",
          "predicate": "statement_record_available",
          "args": [
            "$database",
            "$db_principal",
            "$request"
          ],
          "value": true,
          "description": "当該主体のクエリを対象とする監査が有効で、当該SQLを識別できる記録が取得・保持されている。"
        }
      ]
    }
  ],
  "relatedAttackPatterns": [
    "OWASP SQL Injection"
  ],
  "references": [
    {
      "id": "owasp_sql_injection",
      "title": "OWASP: SQL Injection",
      "url": "https://community.owasp.org/attacks/SQL_Injection",
      "supports": "prerequisites/effects: Webアプリ入力によるSQL処理の改変と、DB側権限に依存する影響。個別被害やOS実行を一律に付与しない。"
    },
    {
      "id": "owasp_sql_prevention",
      "title": "OWASP: SQL Injection Prevention Cheat Sheet",
      "url": "https://cheatsheetseries.owasp.org/cheatsheets/SQL_Injection_Prevention_Cheat_Sheet.html",
      "supports": "input_controls_sql_structure: 値とSQL構造を分離するパラメータ化、およびDB権限の最小化。"
    },
    {
      "id": "owasp_logging",
      "title": "OWASP Logging Cheat Sheet",
      "url": "https://cheatsheetseries.owasp.org/cheatsheets/Logging_Cheat_Sheet.html",
      "supports": "observableArtifacts: ログの取得内容・取得設定・保持を個別に確認する原則。製品固有のイベントIDや既定記録は保証しない。"
    }
  ],
  "stages": [
    "INITIAL_ACCESS"
  ]
}
